{"acceptance_certificate_ref":"accepted/certificates/266b7f4637bef0d9d6c3d542d5c423116a4b097569bc8a9411adc35558623c87.json","accepted_environment_hash":"sha256:2e6239d129a485b17fee83303b043cdbb6fd0ed4fd7219acc0f1f82706562e3a","artifact_kind":"accepted_semantic_ir","contract_input_root":"sha256:f7dce582e03084c2625001893f541d8b90d084c2752c1d177735426c5074743e","exporter_hash":"sha256:f721dd0792de20106816d6929e350db2d8c9f9e0911039a271a57a6233444f85","exporter_id":"verislop.reifier","lean_toolchain":"leanprover/lean4:v4.34.1","obligations":{"A1":{"acceptance_criteria":["Supplied inputs satisfy the specified object schema, 0 <= n <= 500 and m > 0.","Negative and arbitrarily large a and b remain in the functional domain.","No additional caller restriction is imposed."],"dependencies":[{"id":"D1","relation":"uses_definition"}],"formal":{"axioms":[],"formula_ref":"artifact:accepted-expressions/A1@sha256:aee325fa6f44225b5a0c7bb1dae7e76d9d76bd964c6b184bf9081a8121c80638","hypotheses":[],"lean_symbol":"VeriSlopAST.valid_input","reification_evidence_ref":"reification:A1@sha256:be0b07815506631d5dcf654290d03bfbc10cf64047ed65853eb7203e95dc4958","representation":"typed_metadata","semantic_closure_hash":"sha256:c1eb1eab287759af12d8e7ef348bb7950b9b71e994710a7e2ebef79f929439b1","statement_hash":"sha256:3639fe00b51987149254e172c4e69094c4ee327d652f9e7469fed894d443e597"},"id":"A1","kind":"precondition","required":true,"revision":1,"role":"assumption","scope":["supplied inputs"],"source_refs":[{"document_hash":"sha256:7e8c0d17e78afc93ed267ed2738c4d8d2f739a551f7fe20ff302cecbf8fcd83b","document_ref":"tier2:tier2-source-facets-004:A23","end_byte":337,"interpretation":"Supplier assurance.","origin":"explicit","start_byte":280},{"document_hash":"sha256:7e8c0d17e78afc93ed267ed2738c4d8d2f739a551f7fe20ff302cecbf8fcd83b","document_ref":"tier2:tier2-source-facets-004:A23","end_byte":467,"interpretation":"Complete input domain.","origin":"explicit","start_byte":383},{"document_hash":"sha256:7e8c0d17e78afc93ed267ed2738c4d8d2f739a551f7fe20ff302cecbf8fcd83b","document_ref":"tier2:tier2-source-facets-004:A23","end_byte":1222,"interpretation":"No additional preconditions.","origin":"explicit","start_byte":1132},{"document_hash":"sha256:7e8c0d17e78afc93ed267ed2738c4d8d2f739a551f7fe20ff302cecbf8fcd83b","document_ref":"tier2:tier2-source-facets-004:A23","end_byte":3628,"interpretation":"Preserved assumption identity.","origin":"explicit","start_byte":2085}],"statement":"The input supplier provides schema-conforming integer fields {n,m,a,b} satisfying 0 <= n <= 500 and m > 0. The values a and b are arbitrary signed integers without a magnitude bound, including magnitude 10^30. No additional input bounds or preconditions apply."},"D1":{"acceptance_criteria":["The canonical file is program.vscore.json with exactly one admitted typed entry solve of arity 1.","Typed input represents {n,m,a,b} and typed output represents an exact JSON integer.","Source and serialization follow vscore/0.3, normative Lean vscore-semantics/0.3 and data-pipeline/0.3.","Integer and string semantics match the stated mathematical and Unicode domains."],"dependencies":[],"formal":{"axioms":[],"formula_ref":"artifact:accepted-expressions/D1@sha256:d4e4807b29d9c490dfdf7bbff9496ae22ae32108b4114e17984a1b60f33edf86","hypotheses":[],"lean_symbol":"VeriSlopAST.Input","reification_evidence_ref":"reification:D1@sha256:2da8889a5b04453479aec51442fdb9717193c13032e6ef08f2f60ac5c00fc7e5","representation":"typed_metadata","semantic_closure_hash":"sha256:6769566b4aa1099c7db65a98ab8095859e4c68b448c643abcf74af51a208dc0a","statement_hash":"sha256:5e7f1576c35184baff75202d44dd1b27769c6ee6a12526d9d0188e14dad210c8"},"id":"D1","kind":"entity","required":true,"revision":1,"role":"declaration","scope":["source artifact","typed input and output","normative semantics and serialization"],"source_refs":[{"document_hash":"sha256:7e8c0d17e78afc93ed267ed2738c4d8d2f739a551f7fe20ff302cecbf8fcd83b","document_ref":"tier2:tier2-source-facets-004:A23","end_byte":137,"interpretation":"Artifact and entry identity.","origin":"explicit","start_byte":67},{"document_hash":"sha256:7e8c0d17e78afc93ed267ed2738c4d8d2f739a551f7fe20ff302cecbf8fcd83b","document_ref":"tier2:tier2-source-facets-004:A23","end_byte":222,"interpretation":"Typed JSON representation.","origin":"explicit","start_byte":138},{"document_hash":"sha256:7e8c0d17e78afc93ed267ed2738c4d8d2f739a551f7fe20ff302cecbf8fcd83b","document_ref":"tier2:tier2-source-facets-004:A23","end_byte":467,"interpretation":"Integer input fields.","origin":"explicit","start_byte":383},{"document_hash":"sha256:7e8c0d17e78afc93ed267ed2738c4d8d2f739a551f7fe20ff302cecbf8fcd83b","document_ref":"tier2:tier2-source-facets-004:A23","end_byte":762,"interpretation":"Normative source and serialization profiles.","origin":"explicit","start_byte":615},{"document_hash":"sha256:7e8c0d17e78afc93ed267ed2738c4d8d2f739a551f7fe20ff302cecbf8fcd83b","document_ref":"tier2:tier2-source-facets-004:A23","end_byte":1041,"interpretation":"Unbounded integer domain.","origin":"explicit","start_byte":970},{"document_hash":"sha256:7e8c0d17e78afc93ed267ed2738c4d8d2f739a551f7fe20ff302cecbf8fcd83b","document_ref":"tier2:tier2-source-facets-004:A23","end_byte":1131,"interpretation":"Unicode scalar string semantics.","origin":"explicit","start_byte":1042},{"document_hash":"sha256:7e8c0d17e78afc93ed267ed2738c4d8d2f739a551f7fe20ff302cecbf8fcd83b","document_ref":"tier2:tier2-source-facets-004:A23","end_byte":3628,"interpretation":"Preserved declaration identity.","origin":"explicit","start_byte":2085}],"statement":"The deliverable is canonical program.vscore.json with exactly one admitted typed entry solve of arity 1, using vscore/0.3 under normative Lean vscore-semantics/0.3 and data-pipeline/0.3 serialization. Input represents the JSON object {n,m,a,b} with integer fields; output represents an exact JSON integer. Integers are unbounded mathematical integers. Strings contain Unicode scalar values and lexicographic ordering compares scalar codepoints."},"N1":{"acceptance_criteria":["Functional correctness requirements prescribe no behavior for malformed input."],"dependencies":[],"formal":{"axioms":[],"formula_ref":"artifact:accepted-expressions/N1@sha256:5399758458c7cd7c29aa20dfaa87c7e877b6a7ece35e33e17f27e0942dc5b9f5","hypotheses":[],"lean_symbol":"VeriSlop.Registry.N1","reification_evidence_ref":"reification:N1@sha256:b5474c24371bfa73b2bbda1d633a41c52af90e77c4bfe58a5c4c98ac1d740361","representation":"typed_metadata","semantic_closure_hash":"sha256:b1a465e514b8a3c90fb59dc42c014ae7dd3f9666f93e97651cf73d4b112d54dd","statement_hash":"sha256:e05fbb3598d5cd831bc54ecf141f85d00bf0816f38a74ae0db5dfe7c42eab1d4"},"id":"N1","kind":"explicit_non_goal","required":true,"revision":1,"role":"exclusion","scope":["malformed inputs"],"source_refs":[{"document_hash":"sha256:7e8c0d17e78afc93ed267ed2738c4d8d2f739a551f7fe20ff302cecbf8fcd83b","document_ref":"tier2:tier2-source-facets-004:A23","end_byte":382,"interpretation":"Malformed-input exclusion.","origin":"explicit","start_byte":338},{"document_hash":"sha256:7e8c0d17e78afc93ed267ed2738c4d8d2f739a551f7fe20ff302cecbf8fcd83b","document_ref":"tier2:tier2-source-facets-004:A23","end_byte":1733,"interpretation":"Preserve the exclusion ID, role and required flag.","origin":"explicit","start_byte":1654},{"document_hash":"sha256:7e8c0d17e78afc93ed267ed2738c4d8d2f739a551f7fe20ff302cecbf8fcd83b","document_ref":"tier2:tier2-source-facets-004:A23","end_byte":3628,"interpretation":"Preserved N1 exclusion identity.","origin":"explicit","start_byte":2085}],"statement":"No functional result or error behavior is required for malformed input outside the supplied schema and bounds."},"N2":{"acceptance_criteria":["No runtime campaign is required.","Machine-code, compiler, runtime and physical-resource assurance are excluded.","The explicitly trusted components remain stated at the restricted-source boundary."],"dependencies":[],"formal":{"axioms":[],"formula_ref":"artifact:accepted-expressions/N2@sha256:f4f998befb1467966f4369afab30d21ea67cbad885bfa9cdee7eff174fe00c6d","hypotheses":[],"lean_symbol":"VeriSlop.Registry.N2","reification_evidence_ref":"reification:N2@sha256:e8a6e9d780774a06553d9841599554115d567d49ab4fe8aaa5fa7a42de655a14","representation":"typed_metadata","semantic_closure_hash":"sha256:b1a465e514b8a3c90fb59dc42c014ae7dd3f9666f93e97651cf73d4b112d54dd","statement_hash":"sha256:14be90fb1be36c19562603a045d255208d11647e132c04a2b4241325bc51984b"},"id":"N2","kind":"explicit_non_goal","required":true,"revision":1,"role":"exclusion","scope":["assurance boundary"],"source_refs":[{"document_hash":"sha256:7e8c0d17e78afc93ed267ed2738c4d8d2f739a551f7fe20ff302cecbf8fcd83b","document_ref":"tier2:tier2-source-facets-004:A23","end_byte":3665,"interpretation":"Runtime campaigns excluded.","origin":"explicit","start_byte":3629},{"document_hash":"sha256:7e8c0d17e78afc93ed267ed2738c4d8d2f739a551f7fe20ff302cecbf8fcd83b","document_ref":"tier2:tier2-source-facets-004:A23","end_byte":3849,"interpretation":"Restricted-source boundary and explicit trust.","origin":"explicit","start_byte":3666},{"document_hash":"sha256:7e8c0d17e78afc93ed267ed2738c4d8d2f739a551f7fe20ff302cecbf8fcd83b","document_ref":"tier2:tier2-source-facets-004:A23","end_byte":3927,"interpretation":"Excluded assurance levels.","origin":"explicit","start_byte":3850}],"statement":"Runtime campaigns and machine-code, compiler, runtime or physical-resource assurance are outside the requested endpoint. The assurance boundary is normative restricted-source execution with natural-language correspondence, host tooling, the pinned Lean kernel, hashing and OS/hardware explicitly trusted."},"O1":{"acceptance_criteria":["For every valid integer input, actual solve execution returns Σ_{i=0}^{n-1} floor((a*i+b)/m).","Each quotient satisfies q*m <= a*i+b < (q+1)*m; negative numerators use floor toward negative infinity.","Every input with n=0 returns zero.","solve({a:-2,b:1,m